Headline,Data,Content,Soruce,URL,Cleaned_Content
SBB and Canton of Aargau are also affected by hacker attack,2023-06-11,"The Swiss Federal Railways (SBB) and the canton of Aargau are affected by the cyber attack on the company Xplain. Data from both bodies have been stolen, as the SBB and the canton of Aargau announced on Sunday at the request of the Keystone-SDA news agency. The NZZ on Sunday has on the 11th. June reported on it. Data had been drained as part of a data leak, according to SBB. The canton of Aargau also confirmed that it was affected by the attack on the IT service provider Xplain. A spokeswoman for the canton said on request: ""According to today's state of knowledge, we assume that in addition to business correspondence, a small volume of operational data from error logs that were at Xplain for analysis is also affected.""
The exact scope of data theft will be further analyzed internally as well as by Xplain and federal agencies, it continued. Among other things, Xplain has developed applications for the cantonal enforcement services.

The attackers used a vulnerability on Xplain's servers, which housed this data. It is a so-called ransomware attack in which data is stolen and then encrypted.
Infamous hacker gang

The attack on Xplain was on the 23rd. May by Watson publicly known. Among other things, the Federal Office of Police (Fedpol), the Federal Office of Customs and Border Security (BAZG) and various cantonal police are also affected.

Who is behind the hacker attack and data theft is not known. A corresponding threatening letter was published on the darknet page of the ransomware gang Play to put pressure on the victim. A few gigabytes of data have already been published there.

The attack on Xplain has no connection with the one on the parliament website last Wednesday, said a spokeswoman for the National Center for Cyber Security (NCSC) last Thursday.

The Federal Prosecutor's Office (BA) has opened proceedings for the attack on the Swiss Parliament.

According to reports of the Tamedia newspapers, proceedings have also been initiated by the Bernese Public Prosecutor's Office regarding the attack on Xplain. Previously, waton had reported that those responsible had filed a complaint.In recent years, cyber attacks on companies, administrations or even the media have increased. Only recently, the large media houses CH Media and NZZ were affected. SBB was already affected by a cyber attack in February 2023.",Watson ,https://www.watson.ch/schweiz/digital/811971487-auch-sbb-und-kanton-aargau-von-hackerangriff-betroffen,swiss federal railways sbb canton aargau affected cyber attack company xplain data bodies stolen sbb canton aargau announced sunday request keystonesda news agency nzz sunday 11th june reported data drained part data leak according sbb canton aargau also confirmed affected attack service provider xplain spokeswoman canton said request according todays state knowledge assume addition business correspondence small volume operational data error logs xplain analysis also affected exact scope data theft analyzed internally well xplain federal agencies continued among things xplain developed applications cantonal enforcement services attackers used vulnerability xplains servers housed data socalled ransomware attack data stolen encrypted infamous hacker gang attack xplain 23rd may watson publicly known among things federal office police fedpol federal office customs border security bazg various cantonal police also affected behind hacker attack data theft known corresponding threatening letter published darknet page ransomware gang play put pressure victim gigabytes data already published attack xplain connection one parliament website last wednesday said spokeswoman national center cyber security ncsc last thursday federal prosecutors office ba opened proceedings attack swiss parliament according reports tamedia newspapers proceedings also initiated bernese public prosecutors office regarding attack xplain previously waton reported responsible filed complaintin recent years cyber attacks companies administrations even media increased recently large media houses ch media nzz affected sbb already affected cyber attack february 2023
SBB and Canton of Aargau are also affected by hacker attack,2023-11-06,"The Swiss Federal Railways (SBB) and the canton of Aargau are affected by the cyber attack on the company Xplain. Data from both bodies have been stolen, as the SBB and the canton of Aargau announced on Sunday at the request of the Keystone-SDA news agency. The ""NZZ am Sonntag"" had first reported on this. Data had flown away as part of a data leak, it was said to SBB. The canton of Aargau also confirmed that it was affected by the attack on the IT service provider Xplain: ""According to the current state of knowledge, we assume that in addition to business correspondence, a small volume of operational data from error logs that were at Xplain for analysis is also affected,"" said a spokeswoman for the canton on request. The exact scope of data theft will be further analyzed internally as well as by Xplain and federal agencies, it continued. Among other things, Xplain has developed applications for the cantonal enforcement services. The attackers used a vulnerability on Xplain's servers, which housed this data. It is a so-called ransomware attack in which data is stolen and then encrypted. The attack on Xplain was on the 3rd. June known. Among other things, the Federal Office of Police (Fedpol), the Federal Office of Customs and Border Security (BAZG) and cantonal police are also affected. However, the attack on Xplain has no connection with that on the parliamentary website last Wednesday, said a spokeswoman for the National Center for Cyber Security (NCSC) last Thursday.

The Federal Prosecutor's Office (BA) has opened proceedings for the attack on the Swiss Parliament. According to reports of the Tamedia newspapers, proceedings have also been initiated by the Bernese Public Prosecutor's Office regarding the attack on Xplain.

In recent years, cyber attacks on companies, administrations or even the media have increased. Only recently, the large media houses CH Media and NZZ were affected. SBB was already affected by a cyber attack in February 2023.",HANDELSZEITUNG,https://www.handelszeitung.ch/newsticker/auch-sbb-und-kanton-aargau-von-hackerangriff-betroffen-609936,swiss federal railways sbb canton aargau affected cyber attack company xplain data bodies stolen sbb canton aargau announced sunday request keystonesda news agency nzz sonntag first reported data flown away part data leak said sbb canton aargau also confirmed affected attack service provider xplain according current state knowledge assume addition business correspondence small volume operational data error logs xplain analysis also affected said spokeswoman canton request exact scope data theft analyzed internally well xplain federal agencies continued among things xplain developed applications cantonal enforcement services attackers used vulnerability xplains servers housed data socalled ransomware attack data stolen encrypted attack xplain 3rd june known among things federal office police fedpol federal office customs border security bazg cantonal police also affected however attack xplain connection parliamentary website last wednesday said spokeswoman national center cyber security ncsc last thursday federal prosecutors office ba opened proceedings attack swiss parliament according reports tamedia newspapers proceedings also initiated bernese public prosecutors office regarding attack xplain recent years cyber attacks companies administrations even media increased recently large media houses ch media nzz affected sbb already affected cyber attack february 2023
Swiss companies do not want to report IT hacks because they distrust the federal government,2023-09-19,"Important companies such as Swisscom or SBB should better inform the state about cyber attacks, says Parliament. But the economy is in the way. In June, pro-Russian hackers paralyzed various federal websites. In the same month, hackers stole sensitive data from the company Xplain in Interlaken BE, which worked for the Confederation. The federal government had not checked the safety of the company once in the last 15 years, as this editorial team revealed last week. The federal credibility in terms of data security has been severely damaged since then at the latest. The incidents have given a new dimension to the discussion of the extent to which providers of important infrastructures should entrust sensitive data to the state. In the current autumn session, the parliamentary chambers are negotiating this issue within the framework of the new Information Security Act.

In principle, all parties involved agree: If hackers try to penetrate the systems of a critical infrastructure provider, the state must know this. This allows him to report the details as soon as possible to all other potentially threatened organizations so that they can take the necessary measures to protect them. In addition to the authorities of all three state levels, the operators of important infrastructures should also be subject to reporting for such an attack. These include, for example, energy companies, telecom companies, banks, but also the post office, SBB and the three state airports of Zurich, Basel and Geneva.

However, disagreement has ignited on the question of whether, in addition to attacks that have already taken place, they must also report vulnerabilities in their systems that they have discovered themselves. So far, this is voluntary. An example of this could be that an energy company has a security check carried out by a third-party company and that it comes across a poorly protected system.

A report to the National Center for Cyber Security (NCSC) would then be provided within 24 hours. That would probably be too little time for a company to fix the vulnerability before it has to report its existence to the NCSC.

""The danger is great that the reporting obligation for IT vulnerabilities does not strengthen the security of the systems of critical infrastructures, but potentially endangers it,"" wrote an alliance of 26 large companies and associations recently in a letter to all members of the National Council. A report of vulnerabilities and the associated collection at a central, state authority presupposes that the security system of that authority is absolutely safe.

The compromise probably fails

Then the authors of the letter mention the recent attacks on the federal government. The NCSC, whose communication channels to the infrastructure operators and their systems themselves, would become a worthwhile target for attackers through the proposed measure. If they were successful, they could potentially very easily penetrate the systems of several companies and cause great damage to them and the Swiss economy. The National Council did not heed the request of the companies and associations last week. The reporting obligation is too important in principle, found a clear center-left majority. She sent the law back to the Council of States with the order to work out a solution with which the economy could also come to an dear. The Council of States will decide on Tuesday.

A compromise is now up for discussion: According to this, weak points should also be reportable. But, among other things, the deadline for reporting is to be increased from 24 hours to 7 days. In many cases, this would be enough time to close the vulnerability yourself first.

In addition, reports should be submitted anonymously after the compromise proposal. So it would be more difficult for hackers, should they penetrate the communication channels to and from the NCSC, to locate the originally affected company.

However, the infrastructure managers reject the compromise proposal. It also fell significantly under the preliminary advisory commission of the Council of States. It is therefore likely that the affected companies will be able to keep their IT problems to themselves in the future, if no attack has taken place.",tagesanzeiger,http://tagesanzeiger.ch/search?q=SBB%20Cyberangriff,important companies swisscom sbb better inform state cyber attacks says parliament economy way june prorussian hackers paralyzed various federal websites month hackers stole sensitive data company xplain interlaken worked confederation federal government checked safety company last 15 years editorial team revealed last week federal credibility terms data security severely damaged since latest incidents given new dimension discussion extent providers important infrastructures entrust sensitive data state current autumn session parliamentary chambers negotiating issue within framework new information security act principle parties involved agree hackers try penetrate systems critical infrastructure provider state must know allows report details soon possible potentially threatened organizations take necessary measures protect addition authorities three state levels operators important infrastructures also subject reporting attack include example energy companies telecom companies banks also post office sbb three state airports zurich basel geneva however disagreement ignited question whether addition attacks already taken place must also report vulnerabilities systems discovered far voluntary example could energy company security check carried thirdparty company comes across poorly protected system report national center cyber security ncsc would provided within 24 hours would probably little time company fix vulnerability report existence ncsc danger great reporting obligation vulnerabilities strengthen security systems critical infrastructures potentially endangers wrote alliance 26 large companies associations recently letter members national council report vulnerabilities associated collection central state authority presupposes security system authority absolutely safe compromise probably fails authors letter mention recent attacks federal government ncsc whose communication channels infrastructure operators systems would become worthwhile target attackers proposed measure successful could potentially easily penetrate systems several companies cause great damage swiss economy national council heed request companies associations last week reporting obligation important principle found clear centerleft majority sent law back council states order work solution economy could also come dear council states decide tuesday compromise discussion according weak points also reportable among things deadline reporting increased 24 hours 7 days many cases would enough time close vulnerability first addition reports submitted anonymously compromise proposal would difficult hackers penetrate communication channels ncsc locate originally affected company however infrastructure managers reject compromise proposal also fell significantly preliminary advisory commission council states therefore likely affected companies able keep problems future attack taken place
SBB and Canton of Aargau are also affected by hacker attack,2023-11-06,"The Swiss Federal Railways and the canton of Aargau are affected by the cyber attack on the company Xplain. Data from both bodies have been stolen, as the SBB and the canton announced on Sunday.

The ""NZZ am Sonntag"" had first reported on this. Data had been drained as part of a data leak, it was said to the SBB. The canton of Aargau also confirmed that it was affected by the attack on the IT service provider Xplain: ""According to today's state of knowledge, we assume that in addition to business correspondence, a small volume of operational data from error logs that were at Xplain for analysis is also affected,"" said a spokeswoman for the canton on request.

The exact extent of the data theft will be further analyzed internally as well as by Xplain and federal agencies, it was said. Among other things, Xplain has developed applications for the cantonal enforcement services. The attackers used a vulnerability on Xplain's servers, which housed this data. It is a so-called ransomware attack in which data is stolen and then encrypted.",tagesanzeiger,https://www.tagesanzeiger.ch/auch-sbb-und-kanton-aargau-von-hackerangriff-betroffen-392324009259,swiss federal railways canton aargau affected cyber attack company xplain data bodies stolen sbb canton announced sunday nzz sonntag first reported data drained part data leak said sbb canton aargau also confirmed affected attack service provider xplain according todays state knowledge assume addition business correspondence small volume operational data error logs xplain analysis also affected said spokeswoman canton request exact extent data theft analyzed internally well xplain federal agencies said among things xplain developed applications cantonal enforcement services attackers used vulnerability xplains servers housed data socalled ransomware attack data stolen encrypted
SBB and canton of Aargau affected by data leak,2023-11-06,"The hacker group Play stole data from the federal railways and cantonal authorities. SBB does not say whether SBB customer data is also affected. SBB and the canton of Aargau are affected by a hacker attack. This is reported by the ""NZZ on Sunday"". The attackers took advantage of a vulnerability at the company Xplain. The Swiss company offers government software.
SBB confirms to Blick that it has been informed by Xplain that data has flowed away as part of a data leak. The federal railways do not want to say what kind of data is, as there are ""ongoing investigations"" about this, as a SBB spokesman explains. Public prosecutor's office affected?
It was known so far that the hackers captured data from the Federal Office of Police (Fedpol), the Federal Office for Customs and Border Security (BAZG) and cantonal police. The cybercriminals apparently tried to blackmail the company Xplain. In the meantime, part of the data has been published on the darknet.
Another victim is the canton of Aargau. Data is also said to have been stolen from this, reports the ""NZZ am Sonntag"". In the past, the cantonal public prosecutor's office, the Office for Migration and Integration and the enforcement services, among others, have purchased the services of the software company.
Not the first cyber attack on SBB
The Aargau Department of Economics writes to the ""NZZ am Sonntag"" about the stolen data: ""According to today's state of knowledge, we assume that in addition to business correspondence, a small volume of operational data from error logs that were at Xplain for analysis is also affected."" The exact scope will be analyzed.
Behind the attack is said to be the hacker group Play, which in recent months also carried out cyber attacks on the media houses NZZ and CH-Media, among other things.In the process, the attackers invaded the computer system, stole data and encrypted it. Then the companies were blackmailed, in the case of non-payment, the data material was gradually published on the darknet.
This is not the first time that the SBB has lost data. Last year, SBB was targeted by a hacker who stole one million customer data. As Blick research shows at the time, hundreds of millions of customer data were on the presentation plate for years.",Blick,https://www.blick.ch/politik/cyberangriff-groesser-als-angenommen-sbb-und-kanton-aargau-von-datenleck-betroffen-id18655902.html,hacker group play stole data federal railways cantonal authorities sbb say whether sbb customer data also affected sbb canton aargau affected hacker attack reported nzz sunday attackers took advantage vulnerability company xplain swiss company offers government software sbb confirms blick informed xplain data flowed away part data leak federal railways want say kind data ongoing investigations sbb spokesman explains public prosecutors office affected known far hackers captured data federal office police fedpol federal office customs border security bazg cantonal police cybercriminals apparently tried blackmail company xplain meantime part data published darknet another victim canton aargau data also said stolen reports nzz sonntag past cantonal public prosecutors office office migration integration enforcement services among others purchased services software company first cyber attack sbb aargau department economics writes nzz sonntag stolen data according todays state knowledge assume addition business correspondence small volume operational data error logs xplain analysis also affected exact scope analyzed behind attack said hacker group play recent months also carried cyber attacks media houses nzz chmedia among thingsin process attackers invaded computer system stole data encrypted companies blackmailed case nonpayment data material gradually published darknet first time sbb lost data last year sbb targeted hacker stole one million customer data blick research shows time hundreds millions customer data presentation plate years
