Headline,Data,Content,Soruce,URL,Cleaned_Content
XPLAIN DATA BREACH ALSO IMPACTED THE NATIONAL SWISS RAILWAY FSS,2023-06-12,"The Play ransomware attack suffered by the IT services provider Xplain also impacted the national railway company of Switzerland (FSS) and the canton of Aargau.
The Play ransomware attack suffered by the IT services provider Xplain is worse than initially estimated, the incident also impacted the national railway company of Switzerland (FSS) and the canton of Aargau.

In early June, Swiss police launched an investigation into the cyber attack that hit the Bernese IT company Xplain, which provides its services to several federal and cantonal government departments, the army, customs, and the Federal Office of Police (Fedpol).

The news of the attack was first reported by the Swiss newspaper Le Temps.

“for the first time, several cantonal police forces, the Swiss army or the Federal Office of Police (Fedpol) are indirectly affected by a cyberattack.” reads Le Temps. “These major players in security have one thing in common: they have the same IT service provider, the Bernese company Xplain, which has just been hacked.”

Threat actors initially published alleged stolen data from the Federal Office of Police (Fedpol) and the Federal Office for Customs and Border Security (FOCBS) on a Darknet forum.

Local media reported that attackers have exploited a vulnerability on the servers of the company.

Both Fedpol and the federal customs office confirmed the attack but attempted to downplay the incident. According to Fedpol, threat actors only had access to simulated, anonymous data for test purposes.

Xplain notified Fedpol about the attack a few days ago, revealed a Fedpol spokesman who added that the projects of the agency were not exposed.

The Federal Office for Customs and Border Security (FOCBS) said data from the FOCBS that were exposed are from correspondence with its clients.

The news of the FSS data leak was initially reported by the magazine NZZ am Sonntag and later confirmed by the Swiss railway company.

The authorities of the canton of Aargau also confirmed the data breach.

“The Aargau authorities said for their part that they assume that “in addition to company correspondence, a small volume of operational data from error logs which was at Xplain for analysis was also affected”.” reported the website RSI.

The authorities are still investigating the security breach to determine the extent of the attack.

This week, the website of the Swiss parliament has been the target of cyber attack as reported by the president of the House of Representatives, Martin Candinas.

“The problems appeared on Wednesday afternoon. At the end of the day, parliament’s services said the attack had been neutralised and that no internal systems or data had been affected. On Thursday morning, however, there were still problems accessing the websiteExternal link.” reported the website SwissInfo.",securityaffairs,https://securityaffairs.com/147346/malware/national-railway-fss-xplain.html,play ransomware attack suffered services provider xplain also impacted national railway company switzerland fss canton aargau play ransomware attack suffered services provider xplain worse initially estimated incident also impacted national railway company switzerland fss canton aargau early june swiss police launched investigation cyber attack hit bernese company xplain provides services several federal cantonal government departments army customs federal office police fedpol news attack first reported swiss newspaper le temps first time several cantonal police forces swiss army federal office police fedpol indirectly affected cyberattack reads le temps major players security one thing common service provider bernese company xplain hacked threat actors initially published alleged stolen data federal office police fedpol federal office customs border security focbs darknet forum local media reported attackers exploited vulnerability servers company fedpol federal customs office confirmed attack attempted downplay incident according fedpol threat actors access simulated anonymous data test purposes xplain notified fedpol attack days ago revealed fedpol spokesman added projects agency exposed federal office customs border security focbs said data focbs exposed correspondence clients news fss data leak initially reported magazine nzz sonntag later confirmed swiss railway company authorities canton aargau also confirmed data breach aargau authorities said part assume addition company correspondence small volume operational data error logs xplain analysis also affected reported website rsi authorities still investigating security breach determine extent attack week website swiss parliament target cyber attack reported president house representatives martin candinas problems appeared wednesday afternoon end day parliaments services said attack neutralised internal systems data affected thursday morning however still problems accessing websiteexternal link reported website swissinfo
Xplain Hack Aftermath: Play Ransomware Leaks Sensitive Swiss Government Data,2024-03-07,"he Play ransomware group leaked around 65,000 documents belonging to the federal government, including classified documents and login credentials, which were published on its dark web leak site on 14 June 2023.Following the cyberattack on Swiss IT service provider, Xplain, details of the leaked data have been disclosed in a press release from the Swiss National Center for Cybersecurity (NCSC) – The Federal Office for Cybersecurity (BACS) has also taken part in the investigation.

The department analyzed the data leaked stolen by the Play ransomware group from Xplain, which is a “major provider of IT services to national and cantonal authorities,” the department confirmed.

Background

Back in May 2023, hackers exploited a vulnerability to target Xplain servers hosting applications for cantonal services, blocking access until a key or unblocking tool is sent in exchange for ransom. The attack, carried out by the Play ransomware group, had far-reaching consequences, impacting the Federal Office of Police, the Federal Office of Customs and Border Protection, Swiss Federal Railways and Aargau cantonal authorities.

In June 2023, Swiss federal government websites and the Swiss Federal Railways’ online portal were targeted in DDoS attacks, causing several websites to be unavailable. The finance ministry reported on 12 June 2023 that a pro-Russian group, “NoName,” claimed responsibility for the attack on its Telegram channel and that no data was lost in the attack. This group was also involved in the attack on the Swiss parliament website earlier in June 2023.

The Play ransomware group leaked around 65,000 documents belonging to the federal government, including classified documents and login credentials, which were published on its dark web leak site on 14 June 2023.

As per NCSC’s press release published earlier today, the BACS then took over the coordination of incident response within the federal administration and analysis of leaked data. A policy strategy crisis team was formed on 28 June and an administrative investigation was launched officially on 23 August to find out details of data leak at Xplain.Report Details

The BACS emphasized that the report focuses on data types and analysis challenges, not the content of leaked data. Around 70% (around 47,413) of files belong to Xplain and 14% (9,040) to the Federal Administration.  Hackers have leaked 95% of the 9040 files belonging to the Swiss federal government, mainly from the Federal Department of Justice and Police, Federal Office of Justice, Federal Office of Police, State Secretariat for Migration, and ISC-FDJP. 

Around half of the Federal Administration’s files contain sensitive content like personal data, technical information, classified information, and passwords, with 4,779 files containing personal data, and 278 files containing technical information. 121 objects were dubbed classified under the Information Protection Ordinance with 4 of them containing readable passwords.

The department aims to collaborate with authorities and Xplain to address potential consequences. This investigation is expected to be completed in March 2024.

About Play Ransomware Group

The Play ransomware group is believed to be based in Russia and is responsible for around 300 successful attacks on businesses and critical infrastructure in North America, South America, and Europe from June 2022 to October 2023. The group uses a double extortion model, ranging from unauthorized access to external services like RDP and VPN.
",hackread,https://hackread.com/xplain-hack-play-ransomware-leak-swiss-govt-data/,play ransomware group leaked around 65000 documents belonging federal government including classified documents login credentials published dark web leak site 14 june 2023following cyberattack swiss service provider xplain details leaked data disclosed press release swiss national center cybersecurity ncsc federal office cybersecurity bacs also taken part investigation department analyzed data leaked stolen play ransomware group xplain major provider services national cantonal authorities department confirmed background back may 2023 hackers exploited vulnerability target xplain servers hosting applications cantonal services blocking access key unblocking tool sent exchange ransom attack carried play ransomware group farreaching consequences impacting federal office police federal office customs border protection swiss federal railways aargau cantonal authorities june 2023 swiss federal government websites swiss federal railways online portal targeted ddos attacks causing several websites unavailable finance ministry reported 12 june 2023 prorussian group noname claimed responsibility attack telegram channel data lost attack group also involved attack swiss parliament website earlier june 2023 play ransomware group leaked around 65000 documents belonging federal government including classified documents login credentials published dark web leak site 14 june 2023 per ncscs press release published earlier today bacs took coordination incident response within federal administration analysis leaked data policy strategy crisis team formed 28 june administrative investigation launched officially 23 august find details data leak xplainreport details bacs emphasized report focuses data types analysis challenges content leaked data around 70 around 47413 files belong xplain 14 9040 federal administration hackers leaked 95 9040 files belonging swiss federal government mainly federal department justice police federal office justice federal office police state secretariat migration iscfdjp around half federal administrations files contain sensitive content like personal data technical information classified information passwords 4779 files containing personal data 278 files containing technical information 121 objects dubbed classified information protection ordinance 4 containing readable passwords department aims collaborate authorities xplain address potential consequences investigation expected completed march 2024 play ransomware group play ransomware group believed based russia responsible around 300 successful attacks businesses critical infrastructure north america south america europe june 2022 october 2023 group uses double extortion model ranging unauthorized access external services like rdp vpn
"Switzerland: Play ransomware leaked 65,000 government documents",2024-03-07,"The National Cyber Security Centre (NCSC) of Switzerland has released a report on its analysis of a data breach following a ransomware attack on Xplain, disclosing that the incident impacted thousands of sensitive Federal government files.

Xplain is a Swiss technology and software solutions provider for various government departments, administrative units, and even the country's military force. The Play ransomware gang breached the company on May 23, 2023.

At the time, the threat actor claimed to have stolen documents containing confidential information, and in early June 2023, it followed through on its threats and published the stolen data on its darknet portal.The Swiss government started investigating the leaked files and instantly admitted that the leaked data might contain documents belonging to the Federal Administration of Switzerland.

In a new statement published today, the Swiss government confirmed that 65,000 government documents were leaked in the breach:

Out of approximately 1.3 million files published by Play ransomware, about 5% (65,000 documents) are relevant to the Federal Administration.
Most (95%) of those files impact the administrative units of the Federal Department of Justice and Police (FDJP): the Federal Office of Justice, the Federal Office of Police, the State Secretariat for Migration, and the internal IT service center ISC-FDJP.
The Federal Department of Defence, Civil Protection and Sport (DDPS) were minorly affected, accounting for just over 3% of that data.
Around 5,000 documents contained sensitive information, including personal data (names, email addresses, telephone numbers, and addresses), technical details, classified information, and account passwords.
A small set of a few hundred files contained IT system documentation, software or architectural data, and passwords.
The announcement says the administrative investigation, launched on August 23, 2023, is set to be completed by the end of this month, and the full results and cybersecurity recommendations will be shared with the Federal Council.

The investigation's extensive duration is attributed to the complexity of analyzing unstructured data and the large volume of the leaked data, which required significant time and resources to triage documents relevant to the Federal Administration.
Also, analyzing the leaked data for evidence is legally complicated, as confidential information requires inter-agency coordination and participation, inevitably prolonging the process.",bleepcomputer,https://www.bleepingcomputer.com/news/security/switzerland-play-ransomware-leaked-65-000-government-documents/,national cyber security centre ncsc switzerland released report analysis data breach following ransomware attack xplain disclosing incident impacted thousands sensitive federal government files xplain swiss technology software solutions provider various government departments administrative units even countrys military force play ransomware gang breached company may 23 2023 time threat actor claimed stolen documents containing confidential information early june 2023 followed threats published stolen data darknet portalthe swiss government started investigating leaked files instantly admitted leaked data might contain documents belonging federal administration switzerland new statement published today swiss government confirmed 65000 government documents leaked breach approximately 13 million files published play ransomware 5 65000 documents relevant federal administration 95 files impact administrative units federal department justice police fdjp federal office justice federal office police state secretariat migration internal service center iscfdjp federal department defence civil protection sport ddps minorly affected accounting 3 data around 5000 documents contained sensitive information including personal data names email addresses telephone numbers addresses technical details classified information account passwords small set hundred files contained system documentation software architectural data passwords announcement says administrative investigation launched august 23 2023 set completed end month full results cybersecurity recommendations shared federal council investigations extensive duration attributed complexity analyzing unstructured data large volume leaked data required significant time resources triage documents relevant federal administration also analyzing leaked data evidence legally complicated confidential information requires interagency coordination participation inevitably prolonging process
"Xplain Data Breach Hackers Leaked 65,000 Swiss Government Files",2024-03-15,"An inquiry into the May 2023 Xplain data breach found that 5% or 65,000 of the 1.3 million files the Play ransomware gang leaked were relevant to the Swiss government.The Play ransomware gang claimed it stole 907 gigabytes of sensitive documents, including financial records and other files.

On June 1, 2023, the cybergang dumped the entire trove on its darknet data leak site after failing to extort Xplain, a Swiss software solutions company that works with various government agencies.

Immediately, the Federal government admitted that the leaked files contained sensitive information and ordered an administrative investigation on August 23, 2023, of which the National Cyber Security Centre (NCSC) of Switzerland published these preliminary findings.Xplain data breach leaked over 65,000 Swiss government documents

The probe analyzed 1.3 million files published by the Play ransomware gang following the Xplain data breach and found that 5% or 65,000 files were relevant to the Federal government.

However, most files leaked “belonged to Xplain (47,413) with a share of over 70%; around 14% (9,040) belonged to the Federal Administration,” NCSC said.

Most (95%) of the leaked Swiss government files belonged to the administrative units of the Federal Department of Justice and Police, including the Federal Office of Justice, the Federal Office of Police, the State Secretariat for Migration, and the IT service center ISC-FDJP.

Another 3% of files exfiltrated during the Xplain ransomware attack affected the Federal Department of Defence, Civil Protection and Sport (DDPS), while other departments were “only marginally affected.”

Xplain data breach leaked sensitive personal and technical information

The NCSC found that over half (5,182) of the Swiss government files leaked after the Xplain data breach contained personal data, technical information, classified information, and account passwords.

Personal details, including names, email addresses, telephone numbers, and physical addresses, were present in 4,779 Swiss government files leaked in the Xplain data breach. Individuals whose personal information was leaked are at risk of targeted phishing attacks.

Of the 5,182 files, 278 contained “technical information such as documentation on IT systems, software requirement documents or architectural descriptions.” When leaked, this information could help threat actors plan future cyber attacks.

Another 121 files were classified according to the Information Protection Ordinance, meaning their contents could not be disclosed, while 4 had readable passwords. Compromised passwords are among the most prevalent initial access methods that threat actors, including Play ransomware, exploit to breach organizations.

While these findings are insightful, the Swiss government did not disclose the attack vector exploited in the Xplain data breach. However, the group exploits software vulnerabilities, remote desktop protocols (RDPs), virtual private networks (VPNs), and valid accounts to gain access.

The NCSC said a comprehensive analysis will conclude in late March 2024, and a conclusive report with detailed findings and recommendations will be shared with the Federal Council.

The cybersecurity agency also disclosed that the analysis team faced numerous challenges while analyzing the leaked files due to their unstructured nature, the sheer volume of data, and complex legal requirements that demanded inter-agency cooperation.

“Suitable tools were required to process unstructured data records and make their contents readable,” NCSC said. “The objects identified as relevant then had to be manually viewed and categorized.”

- Advertisement -
The Swiss government is among over 300 public and private organizations and critical infrastructure entities in North America, South America, and Europe targeted by Play ransomware (or Playcrypt) between June 2022 and October 2023, according to a joint cybersecurity advisory by the United States and Australia.

In mid-2022, the Play ransomware gang targeted government entities in Latin America and was attributed to the ransomware attack on the City of Oakland that leaked 600 gigabytes of data.

On April 24, 2023, the group also took credit for the ransomware attacks on Lowell, a city of over 100,000 inhabitants in Massachusetts, and Dallas County, Texas.

 ",CPMagazine,https://www.cpomagazine.com/cyber-security/xplain-data-breach-hackers-leaked-65000-swiss-government-files/,inquiry may 2023 xplain data breach found 5 65000 13 million files play ransomware gang leaked relevant swiss governmentthe play ransomware gang claimed stole 907 gigabytes sensitive documents including financial records files june 1 2023 cybergang dumped entire trove darknet data leak site failing extort xplain swiss software solutions company works various government agencies immediately federal government admitted leaked files contained sensitive information ordered administrative investigation august 23 2023 national cyber security centre ncsc switzerland published preliminary findingsxplain data breach leaked 65000 swiss government documents probe analyzed 13 million files published play ransomware gang following xplain data breach found 5 65000 files relevant federal government however files leaked belonged xplain 47413 share 70 around 14 9040 belonged federal administration ncsc said 95 leaked swiss government files belonged administrative units federal department justice police including federal office justice federal office police state secretariat migration service center iscfdjp another 3 files exfiltrated xplain ransomware attack affected federal department defence civil protection sport ddps departments marginally affected xplain data breach leaked sensitive personal technical information ncsc found half 5182 swiss government files leaked xplain data breach contained personal data technical information classified information account passwords personal details including names email addresses telephone numbers physical addresses present 4779 swiss government files leaked xplain data breach individuals whose personal information leaked risk targeted phishing attacks 5182 files 278 contained technical information documentation systems software requirement documents architectural descriptions leaked information could help threat actors plan future cyber attacks another 121 files classified according information protection ordinance meaning contents could disclosed 4 readable passwords compromised passwords among prevalent initial access methods threat actors including play ransomware exploit breach organizations findings insightful swiss government disclose attack vector exploited xplain data breach however group exploits software vulnerabilities remote desktop protocols rdps virtual private networks vpns valid accounts gain access ncsc said comprehensive analysis conclude late march 2024 conclusive report detailed findings recommendations shared federal council cybersecurity agency also disclosed analysis team faced numerous challenges analyzing leaked files due unstructured nature sheer volume data complex legal requirements demanded interagency cooperation suitable tools required process unstructured data records make contents readable ncsc said objects identified relevant manually viewed categorized advertisement swiss government among 300 public private organizations critical infrastructure entities north america south america europe targeted play ransomware playcrypt june 2022 october 2023 according joint cybersecurity advisory united states australia mid2022 play ransomware gang targeted government entities latin america attributed ransomware attack city oakland leaked 600 gigabytes data april 24 2023 group also took credit ransomware attacks lowell city 100000 inhabitants massachusetts dallas county texas
