Headline,Data,Content,Soruce,URL,Cleaned_Content
Swiss government and Federal Railways hit by cyberattacks,2023-06-12,"Swiss federal government websites and the online portal of the Swiss Federal Railways have been victims of malicious online attacks.
Several websites of the federal administration are currently unavailable, Swiss public radio, SRF, reported on Monday.
According to the finance ministry, the sites were hit by a so-called DDoS attack, which aims to overload websites and applications with targeted requests so that they are no longer accessible. No data is lost in a DDoS attack.
The pro-Russian hacker group “NoName” has claimed responsibility for the attack on the federal government on its own Telegram channel, Tages-Anzeiger newspaper said. This group was also behind the attack on the Swiss parliament website (www.parlament.chExternal link) last week.
+ Ransomware attacks on the rise in Switzerland
“Federal IT specialists quickly noticed the attack and are taking steps to restore accessibility to websites and applications as quickly as possible,” the finance ministry said on Monday morning.
+ Hackers steal Swiss police and customs data
The Swiss Federal Railways and the Aargau cantonal authorities have also been affected by an earlier online attack against the Bern-based IT company Xplain, which provides services to federal and cantonal departments.
The national railway company and the canton confirmed to the Swiss News Agency Keystone-SDA that data had been stolen after a ransomware attack. This follows an earlier report in the NZZ am Sonntag newspaper.
The Aargau authorities say “a small volume of operational data linked to error protocols that were analysed at Xplain” is affected by the leak, as well as “commercial correspondence”.
The extent of the data theft is still being analysed by Xplain and the federal authorities. The hackers reportedly used malware to exploit a vulnerability on Xplain servers hosting applications for cantonal services. Ransomware usually blocks all access until a key or an unblocking tool is sent to the victim in exchange for a sum of money.
Far-reaching consequences
The attack on Xplain, revealed on May 23, has had far-reaching consequences. It has affected the Federal Office of Police (Fedpol), the Federal Office of Customs and Border Protection (FOCP) and, according to Le Temps, cantonal police forces. In addition to business correspondence, operational data may also have been affected, according to the National Centre for Cyber Security (NCSC).
After encrypting the stolen data and demanding a ransom from the company, the hackers reportedly published some of the data on the darknet. According to Le Temps, which broke the story, the attack was carried out by the Play group, the same group that recently targeted the Swiss media companies CH Media and NZZ.
There has been a surge in cybercrime in recent years. Cyberattackers have hacked several Swiss private and public targets, with ransomware attacks on the rise.",SWI ,https://www.swissinfo.ch/eng/politics/swiss-government-and-federal-railways-hit-by-cyberattacks/48583086,swiss federal government websites online portal swiss federal railways victims malicious online attacks several websites federal administration currently unavailable swiss public radio srf reported monday according finance ministry sites hit socalled ddos attack aims overload websites applications targeted requests longer accessible data lost ddos attack prorussian hacker group noname claimed responsibility attack federal government telegram channel tagesanzeiger newspaper said group also behind attack swiss parliament website wwwparlamentchexternal link last week ransomware attacks rise switzerland federal specialists quickly noticed attack taking steps restore accessibility websites applications quickly possible finance ministry said monday morning hackers steal swiss police customs data swiss federal railways aargau cantonal authorities also affected earlier online attack bernbased company xplain provides services federal cantonal departments national railway company canton confirmed swiss news agency keystonesda data stolen ransomware attack follows earlier report nzz sonntag newspaper aargau authorities say small volume operational data linked error protocols analysed xplain affected leak well commercial correspondence extent data theft still analysed xplain federal authorities hackers reportedly used malware exploit vulnerability xplain servers hosting applications cantonal services ransomware usually blocks access key unblocking tool sent victim exchange sum money farreaching consequences attack xplain revealed may 23 farreaching consequences affected federal office police fedpol federal office customs border protection focp according le temps cantonal police forces addition business correspondence operational data may also affected according national centre cyber security ncsc encrypting stolen data demanding ransom company hackers reportedly published data darknet according le temps broke story attack carried play group group recently targeted swiss media companies ch media nzz surge cybercrime recent years cyberattackers hacked several swiss private public targets ransomware attacks rise
Hacker finds data security weak spot in Swiss railway system,2022-01-24,"An anonymous hacker gained access to the personal data of thousands of passengers who bought tickets from Swiss Federal Railways. The embarrassing IT security weak spot in the Swisscard system, which has since been fixed, was reported to the Rundschau programmeExternal link on Swiss public television, SRF, on Monday.
The information included the names of the travellers, their date of birth, the number of first- and second-class tickets purchased and the place of departure and destination.
The hacker told Rundschau that the recent attack required no specialist IT knowledge: “The sensitive data was practically public on the internet.”
The data was never made public and has been returned to Swiss Railways. The hacker said they had no criminal intent but merely wanted to expose the problem.
The Federal Data Protection Commissioner was informed of the security breach.
‘Potential for abuse’
“This is a huge meltdown for Swiss Railways,” Otto Hostettler, a journalist and author specialising in internet crime, told Rundschau. “Such data can be sold in hacker forums on the dark web. In the wrong hands it would have great potential for abuse.”
This has been demonstrated by hacks into Swiss municipal databases in recent months, including the towns of Montreux and Rolle in western Switzerland.
The group that hacked the Rolle database posted information on the dark net and warned it could attack other towns, companies or hospitals.
Swiss news magazine Beobachter reported that 2,700 Swiss companies fell victim to ransomware hacks between August 2020 and August 2021. An article in Le Temps newspaper in December estimated that around 2,000 ransomware attacks targeted Switzerland last year.
Swiss companies fear cyberattacks more than Covid-19 disruptions, according to a survey by insurer Allianz published earlier this month.",SWI,https://www.swissinfo.ch/eng/sci-tech/hacker-finds-data-security-weak-spot-in-swiss-railway-system/47287534,anonymous hacker gained access personal data thousands passengers bought tickets swiss federal railways embarrassing security weak spot swisscard system since fixed reported rundschau programmeexternal link swiss public television srf monday information included names travellers date birth number first secondclass tickets purchased place departure destination hacker told rundschau recent attack required specialist knowledge sensitive data practically public internet data never made public returned swiss railways hacker said criminal intent merely wanted expose problem federal data protection commissioner informed security breach potential abuse huge meltdown swiss railways otto hostettler journalist author specialising internet crime told rundschau data sold hacker forums dark web wrong hands would great potential abuse demonstrated hacks swiss municipal databases recent months including towns montreux rolle western switzerland group hacked rolle database posted information dark net warned could attack towns companies hospitals swiss news magazine beobachter reported 2700 swiss companies fell victim ransomware hacks august 2020 august 2021 article le temps newspaper december estimated around 2000 ransomware attacks targeted switzerland last year swiss companies fear cyberattacks covid19 disruptions according survey insurer allianz published earlier month
Hacker attack on federal administration,2023-12-06,"Several websites of the Federal Administration were temporarily no longer accessible.
The reason was a so-called DDoS attack on the systems of the federal administration.
Investigations by the Federal Prosecutor's Office are underway.
The specialists of the Federal Administration had quickly noticed the attack and taken measures to restore the accessibility of the websites and applications as quickly as possible, the Federal Department of Finance (EFD) announced.

The attack apparently applied to the entire federal administration, the National Center for Cyber Security (NCSC) announced on request. At times, a large part of the websites of the federal administration and federal companies as well as several federal applications were not available.

Criminal proceedings against hacker group

The group ""NoName"" has committed itself to the attack online. This group was also behind the attack on parlament.ch that became known last week. The NCSC did not provide any further information on the grouping. According to reports, it is said to be a Russian group. Whether there is a connection with the speech planned for Thursday afternoon by Ukrainian President Volodimir Zelensky before the federal parliament.

Accumulation of cyber attacks
Open the box
The Federal Prosecutor's Office had announced last week that it had opened criminal proceedings due to the attack on the homepage of the parliamentary services. Today's attacks are also the subject of this investigation, the authority announced upon request.

SBB also affected

The SBB was also affected by the DDoS attack. Various online services did not work between about 8 a.m. and 9.45 a.m., as the SBB announced on request. However, the timetable query on SBB Mobile was possible at any time, as was ticket sales via SBB online shop as a guest account, at all ticket machines and in the travel centers.

The problem could be solved in the meantime, SBB announced at noon. All online services would be available normally again.

A DDoS attack (short for Distributed Denial of Service) is about overloading websites and applications with targeted requests in such a way that they are no longer accessible. However, no data flows out.
",SRF,https://www.srf.ch/news/schweiz/ddos-angriff-hackerangriff-auf-bundesverwaltung,several websites federal administration temporarily longer accessible reason socalled ddos attack systems federal administration investigations federal prosecutors office underway specialists federal administration quickly noticed attack taken measures restore accessibility websites applications quickly possible federal department finance efd announced attack apparently applied entire federal administration national center cyber security ncsc announced request times large part websites federal administration federal companies well several federal applications available criminal proceedings hacker group group noname committed attack online group also behind attack parlamentch became known last week ncsc provide information grouping according reports said russian group whether connection speech planned thursday afternoon ukrainian president volodimir zelensky federal parliament accumulation cyber attacks open box federal prosecutors office announced last week opened criminal proceedings due attack homepage parliamentary services todays attacks also subject investigation authority announced upon request sbb also affected sbb also affected ddos attack various online services work 8 945 sbb announced request however timetable query sbb mobile possible time ticket sales via sbb online shop guest account ticket machines travel centers problem could solved meantime sbb announced noon online services would available normally ddos attack short distributed denial service overloading websites applications targeted requests way longer accessible however data flows
Play Ransomware Attack on Xplain Impacts Swiss National Railway and Canton of Aargau,2023-06-14,"In a significant cybersecurity incident, the IT services provider Xplain experienced a Play ransomware attack that had a broader impact than initially estimated. The attack affected the national railway company of Switzerland (FSS) and the canton of Aargau, prompting a Swiss police investigation into Xplain.

Xplain, a Bernese IT company, serves various federal and cantonal government departments, the army, customs, and the Federal Office of Police (Fedpol). The attack on Xplain indirectly affected these major security entities as they all share the same IT service provider.

Threat actors initially published alleged stolen data from Fedpol and the Federal Office for Customs and Border Security (FOCBS) on a Darknet forum. Local media reports suggest that the attackers exploited a vulnerability on Xplain's servers, leading to the Xplain data breach.

Fedpol confirmed the attack but stated that threat actors only accessed simulated, anonymous data used for testing purposes, and the agency's projects were not exposed. FOCBS acknowledged that data exposed in the breach were from correspondence with its clients.

The FSS data leak was first reported by NZZ am Sonntag magazine and later confirmed by the Swiss railway company. The authorities of the canton of Aargau confirmed the data breach and mentioned that a small volume of operational data from error logs at Xplain for analysis might also have been affected.

The investigation is ongoing to determine the full extent of the Play ransomware attack. In a separate incident, the website of the Swiss parliament faced a cyber attack, but it is not linked to the XPlay ransomware attack. The Swiss parliament reported that the attack had been neutralized, with no impact on internal systems or data.

The Xplain data breach, resulting from a Play ransomware attack, had a significant impact on the national Swiss railway company (FSS) and the canton of Aargau. The breach affected multiple government departments and security entities that share the same IT service provider. Investigations are underway to assess the scope of the attack and the compromised data.",tempesttechinca,https://www.tempesttechnica.com.au/blog/play-ransomware-attack-on-xplain-impacts-swiss-national-railway-and-canton-of-aargau,significant cybersecurity incident services provider xplain experienced play ransomware attack broader impact initially estimated attack affected national railway company switzerland fss canton aargau prompting swiss police investigation xplain xplain bernese company serves various federal cantonal government departments army customs federal office police fedpol attack xplain indirectly affected major security entities share service provider threat actors initially published alleged stolen data fedpol federal office customs border security focbs darknet forum local media reports suggest attackers exploited vulnerability xplains servers leading xplain data breach fedpol confirmed attack stated threat actors accessed simulated anonymous data used testing purposes agencys projects exposed focbs acknowledged data exposed breach correspondence clients fss data leak first reported nzz sonntag magazine later confirmed swiss railway company authorities canton aargau confirmed data breach mentioned small volume operational data error logs xplain analysis might also affected investigation ongoing determine full extent play ransomware attack separate incident website swiss parliament faced cyber attack linked xplay ransomware attack swiss parliament reported attack neutralized impact internal systems data xplain data breach resulting play ransomware attack significant impact national swiss railway company fss canton aargau breach affected multiple government departments security entities share service provider investigations underway assess scope attack compromised data
XPLAIN DATA BREACH ALSO IMPACTED THE NATIONAL SWISS RAILWAY FSS,2023-06-18,"
The Play ransomware attack suffered by the IT services provider Xplain also impacted the national railway company of Switzerland (FSS) and the canton of Aargau.

The Play ransomware attack suffered by the IT services provider Xplain is worse than initially estimated, the incident also impacted the national railway company of Switzerland (FSS) and the canton of Aargau.

In early June, Swiss police launched an investigation into the cyber attack that hit the Bernese IT company Xplain, which provides its services to several federal and cantonal government departments, the army, customs, and the Federal Office of Police (Fedpol).

The news of the attack was first reported by the Swiss newspaper Le Temps.

“for the first time, several cantonal police forces, the Swiss army or the Federal Office of Police (Fedpol) are indirectly affected by a cyberattack.” reads Le Temps. “These major players in security have one thing in common: they have the same IT service provider, the Bernese company Xplain, which has just been hacked.”

Threat actors initially published alleged stolen data from the Federal Office of Police (Fedpol) and the Federal Office for Customs and Border Security (FOCBS) on a Darknet forum.

Local media reported that attackers have exploited a vulnerability on the servers of the company.

Both Fedpol and the federal customs office confirmed the attack but attempted to downplay the incident. According to Fedpol, threat actors only had access to simulated, anonymous data for test purposes.

Xplain notified Fedpol about the attack a few days ago, revealed a Fedpol spokesman who added that the projects of the agency were not exposed.

The Federal Office for Customs and Border Security (FOCBS) said data from the FOCBS that were exposed are from correspondence with its clients.

The news of the FSS data leak was initially reported by the magazine NZZ am Sonntag and later confirmed by the Swiss railway company.

The authorities of the canton of Aargau also confirmed the data breach.

“The Aargau authorities said for their part that they assume that “in addition to company correspondence, a small volume of operational data from error logs which was at Xplain for analysis was also affected”.” reported the website RSI.

The authorities are still investigating the security breach to determine the extent of the attack.

This week, the website of the Swiss parliament has been the target of cyber attack as reported by the president of the House of Representatives, Martin Candinas.

“The problems appeared on Wednesday afternoon. At the end of the day, parliament’s services said the attack had been neutralised and that no internal systems or data had been affected. On Thursday morning, however, there were still problems accessing the websiteExternal link.” reported the website SwissInfo.

The attack is not linked to the XPlay ransomware attack.
",secoperations,https://secoperations.wordpress.com/2023/06/18/xplain-data-breach-also-impacted-the-national-swiss-railway-fss/,play ransomware attack suffered services provider xplain also impacted national railway company switzerland fss canton aargau play ransomware attack suffered services provider xplain worse initially estimated incident also impacted national railway company switzerland fss canton aargau early june swiss police launched investigation cyber attack hit bernese company xplain provides services several federal cantonal government departments army customs federal office police fedpol news attack first reported swiss newspaper le temps first time several cantonal police forces swiss army federal office police fedpol indirectly affected cyberattack reads le temps major players security one thing common service provider bernese company xplain hacked threat actors initially published alleged stolen data federal office police fedpol federal office customs border security focbs darknet forum local media reported attackers exploited vulnerability servers company fedpol federal customs office confirmed attack attempted downplay incident according fedpol threat actors access simulated anonymous data test purposes xplain notified fedpol attack days ago revealed fedpol spokesman added projects agency exposed federal office customs border security focbs said data focbs exposed correspondence clients news fss data leak initially reported magazine nzz sonntag later confirmed swiss railway company authorities canton aargau also confirmed data breach aargau authorities said part assume addition company correspondence small volume operational data error logs xplain analysis also affected reported website rsi authorities still investigating security breach determine extent attack week website swiss parliament target cyber attack reported president house representatives martin candinas problems appeared wednesday afternoon end day parliaments services said attack neutralised internal systems data affected thursday morning however still problems accessing websiteexternal link reported website swissinfo attack linked xplay ransomware attack
